{
  "$schema": "https://json-schema.org/draft/2020-12/schema",
  "type": "object",
  "properties": {
    "$schema": {
      "type": "string"
    },
    "version": {
      "type": "number",
      "const": 1
    },
    "id": {
      "type": "string",
      "pattern": "^[a-zA-Z0-9][a-zA-Z0-9._-]{0,95}$"
    },
    "title": {
      "type": "string",
      "minLength": 1,
      "maxLength": 16384,
      "pattern": "\\S"
    },
    "outcome": {
      "type": "string",
      "minLength": 1,
      "maxLength": 16384,
      "pattern": "\\S"
    },
    "scope": {
      "minItems": 1,
      "type": "array",
      "items": {
        "type": "string",
        "minLength": 1,
        "maxLength": 16384,
        "pattern": "\\S"
      }
    },
    "invariants": {
      "default": [],
      "type": "array",
      "items": {
        "type": "string",
        "minLength": 1,
        "maxLength": 16384,
        "pattern": "\\S"
      }
    },
    "authority": {
      "default": [],
      "type": "array",
      "items": {
        "type": "string",
        "minLength": 1,
        "maxLength": 16384,
        "pattern": "\\S"
      }
    },
    "decisions": {
      "default": [],
      "type": "array",
      "items": {
        "type": "object",
        "properties": {
          "question": {
            "type": "string",
            "minLength": 1,
            "maxLength": 16384,
            "pattern": "\\S"
          },
          "choice": {
            "type": "string",
            "minLength": 1,
            "maxLength": 16384,
            "pattern": "\\S"
          },
          "basis": {
            "type": "string",
            "minLength": 1,
            "maxLength": 16384,
            "pattern": "\\S"
          }
        },
        "required": [
          "question",
          "choice",
          "basis"
        ],
        "additionalProperties": false
      }
    },
    "context": {
      "default": [],
      "type": "array",
      "items": {
        "type": "object",
        "properties": {
          "path": {
            "type": "string",
            "minLength": 1,
            "maxLength": 16384,
            "pattern": "\\S"
          },
          "why": {
            "type": "string",
            "minLength": 1,
            "maxLength": 16384,
            "pattern": "\\S"
          }
        },
        "required": [
          "path",
          "why"
        ],
        "additionalProperties": false
      }
    },
    "mode": {
      "type": "string",
      "enum": [
        "implementation",
        "design",
        "diagnosis",
        "review"
      ]
    },
    "defaultClaim": {
      "type": "string",
      "pattern": "^[a-zA-Z0-9][a-zA-Z0-9._-]{0,95}$"
    },
    "claims": {
      "minItems": 1,
      "type": "array",
      "items": {
        "type": "string",
        "pattern": "^[a-zA-Z0-9][a-zA-Z0-9._-]{0,95}$"
      }
    },
    "nonGoals": {
      "default": [],
      "type": "array",
      "items": {
        "type": "string",
        "minLength": 1,
        "maxLength": 16384,
        "pattern": "\\S"
      }
    },
    "obligations": {
      "minItems": 1,
      "type": "array",
      "items": {
        "anyOf": [
          {
            "type": "object",
            "properties": {
              "id": {
                "type": "string",
                "pattern": "^[a-zA-Z0-9][a-zA-Z0-9._-]{0,95}$"
              },
              "description": {
                "type": "string",
                "minLength": 1,
                "maxLength": 16384,
                "pattern": "\\S"
              },
              "claims": {
                "minItems": 1,
                "type": "array",
                "items": {
                  "type": "string",
                  "pattern": "^[a-zA-Z0-9][a-zA-Z0-9._-]{0,95}$"
                }
              },
              "checks": {
                "minItems": 1,
                "type": "array",
                "items": {
                  "type": "string",
                  "pattern": "^[a-zA-Z0-9][a-zA-Z0-9._-]{0,95}$"
                }
              }
            },
            "required": [
              "id",
              "description",
              "claims",
              "checks"
            ],
            "additionalProperties": false
          },
          {
            "type": "object",
            "properties": {
              "id": {
                "type": "string",
                "pattern": "^[a-zA-Z0-9][a-zA-Z0-9._-]{0,95}$"
              },
              "description": {
                "type": "string",
                "minLength": 1,
                "maxLength": 16384,
                "pattern": "\\S"
              },
              "claims": {
                "minItems": 1,
                "type": "array",
                "items": {
                  "type": "string",
                  "pattern": "^[a-zA-Z0-9][a-zA-Z0-9._-]{0,95}$"
                }
              },
              "external": {
                "type": "string",
                "minLength": 1,
                "maxLength": 16384,
                "pattern": "\\S"
              }
            },
            "required": [
              "id",
              "description",
              "claims",
              "external"
            ],
            "additionalProperties": false
          }
        ]
      }
    }
  },
  "required": [
    "version",
    "id",
    "title",
    "outcome",
    "scope",
    "mode",
    "defaultClaim",
    "claims",
    "obligations"
  ],
  "additionalProperties": false
}
